{
  "schema_version": "1.0.0",
  "event": {"id": "4a5b6c7d-18d8-43fb-8ecf-95a6b7c8d9e0", "kind": "event", "category": "network", "type": "acl_match", "name": "Router ACL denied traffic"},
  "time": {"observed_at": "2026-08-30T10:40:30Z", "ingested_at": "2026-08-30T10:40:31Z", "normalized_at": "2026-08-30T10:40:32Z"},
  "source": {"ip": "203.0.113.60", "port": 5353},
  "destination": {"ip": "192.0.2.60", "port": 53},
  "observer": {"vendor": "example_vendor", "product": "edge_router", "type": "router", "hostname": "router-01", "serial_number": "EXAMPLE-RTR-001", "software_version": "1.0"},
  "network": {"transport": "udp", "application_protocol": "dns", "direction": "inbound", "bytes": 0, "packets": 1},
  "action": {"original": "Deny", "normalized": "deny", "outcome": "failure"},
  "severity": {"original": "Medium", "normalized": 4, "label": "medium"},
  "traceability": {"raw_event_id": "5b6c7d8e-29e9-440c-9fd0-a6b7c8d9e0f1", "raw_sha256": "846fc8f8634eb9e52676132963945d2121bdb6d7c16c38f9432ba3110f889a5d", "source_pack": {"name": "example_router", "version": "1.0.0"}, "parser": {"name": "router_parser", "version": "1.0.0"}},
  "quality": {"status": "valid", "parsing_confidence": 1.0, "missing_fields": [], "warnings": []},
  "extensions": {"example_vendor": {"acl": "EDGE-IN"}}
}
