{
  "schema_version": "1.0.0",
  "event": {
    "id": "e4f80516-b272-4d95-8e6a-3f4051627384",
    "kind": "event",
    "category": "intrusion_detection",
    "type": "signature_match",
    "name": "ET EXPLOIT Apache Log4j RCE Attempt (CVE-2021-44228)",
    "message": "ET EXPLOIT Apache Log4j RCE Attempt (CVE-2021-44228) in HTTP Header"
  },
  "time": {
    "observed_at": "2026-08-30T10:25:30Z",
    "ingested_at": "2026-08-30T10:25:31Z",
    "normalized_at": "2026-08-30T10:25:32Z"
  },
  "source": {
    "ip": "192.0.2.30",
    "port": 51888
  },
  "destination": {
    "ip": "198.51.100.30",
    "port": 443
  },
  "observer": {
    "vendor": "open_information_security_foundation",
    "product": "suricata",
    "type": "ids",
    "hostname": "sensor-core-01",
    "serial_number": "SURI-IDS-9921",
    "software_version": "7.0.2"
  },
  "network": {
    "transport": "tcp",
    "application_protocol": "https",
    "direction": "inbound",
    "bytes": 1420,
    "packets": 8
  },
  "action": {
    "original": "Alert",
    "normalized": "detect",
    "outcome": "unknown",
    "reason": "Signature threshold triggered"
  },
  "severity": {
    "original": "1",
    "normalized": 9,
    "label": "critical"
  },
  "threat": {
    "name": "ET EXPLOIT Apache Log4j RCE Attempt (CVE-2021-44228)",
    "signature_id": "2034334",
    "category": "exploit",
    "confidence": 0.96
  },
  "traceability": {
    "raw_event_id": "f5161627-c383-4ea6-9f7b-405162738495",
    "raw_sha256": "8b43c5a3cc7299d9d49a7b0f6bd84f90499fecb4aa8d24cdef34a8e2bd51e0af",
    "source_pack": {
      "name": "suricata_pack",
      "version": "1.0.0"
    },
    "parser": {
      "name": "suricata_eve_json_parser",
      "version": "1.0.0"
    }
  },
  "quality": {
    "status": "valid",
    "parsing_confidence": 0.96,
    "missing_fields": [],
    "warnings": []
  },
  "extensions": {
    "suricata": {
      "gid": 1,
      "signature_rev": 3,
      "flow_id": 182736451928374
    }
  }
}
