{
  "schema_version": "1.0.0",
  "event": {
    "id": "b981f746-dc29-4f19-91d4-1c6edca806e5",
    "kind": "event",
    "category": "network",
    "type": "connection",
    "name": "Firewall traffic allowed"
  },
  "time": {
    "observed_at": "2026-08-30T10:15:30Z",
    "ingested_at": "2026-08-30T10:15:31Z",
    "normalized_at": "2026-08-30T10:15:32Z"
  },
  "source": {"ip": "192.0.2.10", "port": 51514},
  "destination": {"ip": "198.51.100.20", "port": 443},
  "observer": {"vendor": "example_vendor", "product": "edge_firewall", "type": "firewall"},
  "network": {"transport": "tcp", "application_protocol": "https", "direction": "outbound"},
  "action": {"original": "Accept", "normalized": "allow", "outcome": "success"},
  "severity": {"original": "Info", "normalized": 0, "label": "informational"},
  "traceability": {
    "raw_event_id": "c065ea9a-04fc-4a45-8aa9-b6a919a0fdf6",
    "raw_sha256": "aaaaaaaaaaaaaaaaaaaaaaaaaaaaaaaaaaaaaaaaaaaaaaaaaaaaaaaaaaaaaaaa",
    "source_pack": {"name": "example_firewall", "version": "1.0.0"},
    "parser": {"name": "syslog_parser", "version": "1.0.0"}
  },
  "quality": {"status": "valid", "parsing_confidence": 1.0, "missing_fields": [], "warnings": []}
}
